{
  "phase": "P07",
  "name": "Complete Database Architecture - Review Only",
  "review_only": true,
  "entities": [
    {
      "name": "profiles",
      "purpose": "Primary identity and profile root for all user-owned data.",
      "columns": [
        {
          "name": "profile_id",
          "data_type": "uuid",
          "nullable": false,
          "default": null
        },
        {
          "name": "clerk_user_id",
          "data_type": "text",
          "nullable": false,
          "default": null
        },
        {
          "name": "supabase_user_id",
          "data_type": "text",
          "nullable": false,
          "default": null
        },
        {
          "name": "display_name",
          "data_type": "text",
          "nullable": false,
          "default": null
        },
        {
          "name": "account_status",
          "data_type": "text",
          "nullable": false,
          "default": "active"
        },
        {
          "name": "created_at",
          "data_type": "timestamptz",
          "nullable": false,
          "default": "now()"
        },
        {
          "name": "updated_at",
          "data_type": "timestamptz",
          "nullable": false,
          "default": "now()"
        }
      ],
      "primary_key": {
        "columns": [
          "profile_id"
        ]
      },
      "foreign_keys": [],
      "unique_constraints": [
        {
          "name": "uq_profiles_clerk",
          "columns": [
            "clerk_user_id"
          ]
        },
        {
          "name": "uq_profiles_supabase",
          "columns": [
            "supabase_user_id"
          ]
        }
      ],
      "check_constraints": [
        {
          "name": "ck_profiles_status",
          "expression": "account_status in ('active','suspended','deleted')"
        }
      ],
      "indexes": [
        {
          "name": "idx_profiles_clerk_user_id",
          "columns": [
            "clerk_user_id"
          ],
          "kind": "btree"
        },
        {
          "name": "idx_profiles_supabase_user_id",
          "columns": [
            "supabase_user_id"
          ],
          "kind": "btree"
        },
        {
          "name": "idx_profiles_status",
          "columns": [
            "account_status"
          ],
          "kind": "btree"
        }
      ],
      "owner": "user",
      "data_classification": "sensitive",
      "retention": "until account deletion + legal hold window",
      "lifecycle_states": [
        "active",
        "suspended",
        "deleted"
      ]
    },
    {
      "name": "account_types",
      "purpose": "Maps profiles to account and sector enrollment types.",
      "columns": [
        {
          "name": "account_type_id",
          "data_type": "uuid",
          "nullable": false,
          "default": null
        },
        {
          "name": "profile_id",
          "data_type": "uuid",
          "nullable": false,
          "default": null
        },
        {
          "name": "account_type_code",
          "data_type": "text",
          "nullable": false,
          "default": null
        },
        {
          "name": "sector_code",
          "data_type": "text",
          "nullable": false,
          "default": null
        },
        {
          "name": "is_active",
          "data_type": "boolean",
          "nullable": false,
          "default": "true"
        },
        {
          "name": "effective_from",
          "data_type": "timestamptz",
          "nullable": false,
          "default": "now()"
        }
      ],
      "primary_key": {
        "columns": [
          "account_type_id"
        ]
      },
      "foreign_keys": [
        {
          "column": "profile_id",
          "ref_entity": "profiles",
          "ref_column": "profile_id",
          "on_delete": "cascade",
          "on_update": "cascade"
        }
      ],
      "unique_constraints": [
        {
          "name": "uq_account_types_profile_sector",
          "columns": [
            "profile_id",
            "account_type_code",
            "sector_code"
          ]
        }
      ],
      "check_constraints": [
        {
          "name": "ck_account_type_code",
          "expression": "account_type_code <> ''"
        }
      ],
      "indexes": [
        {
          "name": "idx_account_types_profile",
          "columns": [
            "profile_id"
          ],
          "kind": "btree"
        },
        {
          "name": "idx_account_types_sector",
          "columns": [
            "sector_code"
          ],
          "kind": "btree"
        }
      ],
      "owner": "user",
      "data_classification": "private",
      "retention": "account lifetime",
      "lifecycle_states": [
        "active",
        "disabled"
      ]
    },
    {
      "name": "sector_publishing_permissions",
      "purpose": "Authoritative publishing permissions per profile and sector.",
      "columns": [
        {
          "name": "permission_id",
          "data_type": "uuid",
          "nullable": false,
          "default": null
        },
        {
          "name": "profile_id",
          "data_type": "uuid",
          "nullable": false,
          "default": null
        },
        {
          "name": "sector_code",
          "data_type": "text",
          "nullable": false,
          "default": null
        },
        {
          "name": "posting_cap",
          "data_type": "integer",
          "nullable": false,
          "default": "0"
        },
        {
          "name": "permission_state",
          "data_type": "text",
          "nullable": false,
          "default": "active"
        },
        {
          "name": "updated_at",
          "data_type": "timestamptz",
          "nullable": false,
          "default": "now()"
        }
      ],
      "primary_key": {
        "columns": [
          "permission_id"
        ]
      },
      "foreign_keys": [
        {
          "column": "profile_id",
          "ref_entity": "profiles",
          "ref_column": "profile_id",
          "on_delete": "cascade",
          "on_update": "cascade"
        }
      ],
      "unique_constraints": [
        {
          "name": "uq_permissions_profile_sector",
          "columns": [
            "profile_id",
            "sector_code"
          ]
        }
      ],
      "check_constraints": [
        {
          "name": "ck_posting_cap",
          "expression": "posting_cap >= 0"
        }
      ],
      "indexes": [
        {
          "name": "idx_permissions_profile",
          "columns": [
            "profile_id"
          ],
          "kind": "btree"
        },
        {
          "name": "idx_permissions_sector",
          "columns": [
            "sector_code"
          ],
          "kind": "btree"
        }
      ],
      "owner": "platform",
      "data_classification": "admin",
      "retention": "while entitlement active + audit window",
      "lifecycle_states": [
        "active",
        "revoked"
      ]
    },
    {
      "name": "listings",
      "purpose": "Marketplace listing records across sectors.",
      "columns": [
        {
          "name": "listing_id",
          "data_type": "uuid",
          "nullable": false,
          "default": null
        },
        {
          "name": "profile_id",
          "data_type": "uuid",
          "nullable": false,
          "default": null
        },
        {
          "name": "sector_code",
          "data_type": "text",
          "nullable": false,
          "default": null
        },
        {
          "name": "lifecycle_state",
          "data_type": "text",
          "nullable": false,
          "default": "draft"
        },
        {
          "name": "title_ar",
          "data_type": "text",
          "nullable": false,
          "default": null
        },
        {
          "name": "title_en",
          "data_type": "text",
          "nullable": true,
          "default": null
        },
        {
          "name": "search_norm_ar",
          "data_type": "text",
          "nullable": true,
          "default": null
        },
        {
          "name": "published_at",
          "data_type": "timestamptz",
          "nullable": true,
          "default": null
        },
        {
          "name": "archived_at",
          "data_type": "timestamptz",
          "nullable": true,
          "default": null
        },
        {
          "name": "created_at",
          "data_type": "timestamptz",
          "nullable": false,
          "default": "now()"
        }
      ],
      "primary_key": {
        "columns": [
          "listing_id"
        ]
      },
      "foreign_keys": [
        {
          "column": "profile_id",
          "ref_entity": "profiles",
          "ref_column": "profile_id",
          "on_delete": "cascade",
          "on_update": "cascade"
        }
      ],
      "unique_constraints": [],
      "check_constraints": [
        {
          "name": "ck_listings_state",
          "expression": "lifecycle_state in ('draft','published','archived','deleted')"
        }
      ],
      "indexes": [
        {
          "name": "idx_listings_profile",
          "columns": [
            "profile_id"
          ],
          "kind": "btree"
        },
        {
          "name": "idx_listings_sector_state",
          "columns": [
            "sector_code",
            "lifecycle_state"
          ],
          "kind": "btree"
        },
        {
          "name": "idx_listings_published_at",
          "columns": [
            "published_at"
          ],
          "kind": "btree"
        },
        {
          "name": "idx_listings_search_norm_ar",
          "columns": [
            "search_norm_ar"
          ],
          "kind": "btree"
        }
      ],
      "owner": "user",
      "data_classification": "public",
      "retention": "soft-delete 180 days then archive",
      "lifecycle_states": [
        "draft",
        "published",
        "archived",
        "deleted"